<?xml version="1.0" encoding="UTF-8"?>
<pet xmlns:xsi="http://www.w3.org/2001/XMLSchema-instance"
	xsi:noNamespaceSchemaLocation="../../validation/pet.xsd">
	<name>test_pet</name>
	<year_results_table>
		<year_result>
			<description>description_1</description>
			<lower_limit>1</lower_limit>
		</year_result>
		<year_result>
			<description>description_2</description>
			<lower_limit>6</lower_limit>
			<puppy_name>puppy_1</puppy_name>
		</year_result>
		<year_result>
			<description>description_3</description>
			<lower_limit>11</lower_limit>
			<dies>true</dies>
		</year_result>
		<year_result>
			<description>description_4</description>
			<lower_limit>13</lower_limit>
			<money>
				<libra>11</libra>
				<denarii>22</denarii>
			</money>
		</year_result>
	</year_results_table>
</pet>